{
  "contractId": "insight.capability-matrix",
  "schemaVersion": "1.0.0",
  "scope": "INS-066",
  "status": "frozen",
  "source": {
    "path": "context/project-overview.md",
    "sha256": "bbeaf82c539a7d939d730a3751a37e0efd1c25034981730fa41a08884d19f654"
  },
  "releaseModes": ["research-build", "controlled-clinical"],
  "rows": [
    {"id":"CAP-001","sourceRef":"goal-1","capability":"Modular interoperable workflow","requirement":"required","implementationIssues":["INS-002","INS-079"],"contractSchemas":["deploy/runtime-policy.json"],"releaseApplicability":{"research-build":"required","controlled-clinical":"required"}},
    {"id":"CAP-002","sourceRef":"goal-2","capability":"Reproducible explainable decision support","requirement":"required","implementationIssues":["INS-075","INS-076"],"contractSchemas":["contracts/model-manifest-v1.json","planned:INS-076:treatment-plan-v1"],"releaseApplicability":{"research-build":"required","controlled-clinical":"required"}},
    {"id":"CAP-003","sourceRef":"goal-3","capability":"Psychiatrist authority and immutable plan lifecycle","requirement":"required","implementationIssues":["INS-010","INS-076","INS-077","INS-078"],"contractSchemas":["contracts/treatment-plan-safety-policy-v1.json","planned:INS-076:treatment-plan-v1"],"releaseApplicability":{"research-build":"required","controlled-clinical":"required"}},

    {"id":"CAP-004","sourceRef":"core-flow-1","capability":"Administrator provisioning and psychiatrist sign-in","requirement":"required","implementationIssues":["INS-067","INS-080"],"contractSchemas":["contracts/internal-service-auth-v1.json","contracts/administration-operations-v1.json"],"releaseApplicability":{"research-build":"required","controlled-clinical":"required"}},
    {"id":"CAP-005","sourceRef":"core-flow-2","capability":"Versioned disclaimer review","requirement":"required","implementationIssues":["INS-067"],"contractSchemas":["planned:INS-067:authentication-session-v1"],"releaseApplicability":{"research-build":"required","controlled-clinical":"required"}},
    {"id":"CAP-006","sourceRef":"core-flow-3","capability":"Canonical patient creation and lookup","requirement":"required","implementationIssues":["INS-069"],"contractSchemas":["contracts/clinical-ownership-v1.json","planned:INS-069:patient-v1"],"releaseApplicability":{"research-build":"required","controlled-clinical":"required"}},
    {"id":"CAP-007","sourceRef":"core-flow-4","capability":"Dated initial or follow-up Encounter","requirement":"required","implementationIssues":["INS-069","INS-078"],"contractSchemas":["contracts/clinical-ownership-v1.json","planned:INS-069:encounter-v1"],"releaseApplicability":{"research-build":"required","controlled-clinical":"required"}},
    {"id":"CAP-008","sourceRef":"core-flow-5","capability":"Complete encounter-scoped clinical inputs","requirement":"required","implementationIssues":["INS-070","INS-071","INS-072","INS-073"],"contractSchemas":["planned:INS-070:diagnosis-v1","planned:INS-071:severity-v1","planned:INS-072:medical-history-v1","planned:INS-073:suicide-risk-v1"],"releaseApplicability":{"research-build":"required","controlled-clinical":"required"}},
    {"id":"CAP-009","sourceRef":"core-flow-6","capability":"Immutable input snapshot and idempotent recommendation run","requirement":"required","implementationIssues":["INS-076"],"contractSchemas":["planned:INS-076:treatment-plan-v1"],"releaseApplicability":{"research-build":"required","controlled-clinical":"required"}},
    {"id":"CAP-010","sourceRef":"core-flow-7","capability":"Identity, schema, freshness, resolution, and consistency validation","requirement":"required","implementationIssues":["INS-076"],"contractSchemas":["contracts/scope-matrix-v1.json","contracts/treatment-plan-safety-policy-v1.json"],"releaseApplicability":{"research-build":"required","controlled-clinical":"required"}},
    {"id":"CAP-011","sourceRef":"core-flow-8","capability":"DDI and governed Bayesian evaluation","requirement":"required","implementationIssues":["INS-074","INS-075","INS-076"],"contractSchemas":["contracts/knowledge-source-manifest-v1.json","contracts/model-manifest-v1.json"],"releaseApplicability":{"research-build":"required","controlled-clinical":"required"}},
    {"id":"CAP-012","sourceRef":"core-flow-9","capability":"Explainable advisory Primary Treatment Plan","requirement":"required","implementationIssues":["INS-076","INS-077"],"contractSchemas":["contracts/treatment-plan-safety-policy-v1.json","planned:INS-076:treatment-plan-v1"],"releaseApplicability":{"research-build":"required","controlled-clinical":"required"}},
    {"id":"CAP-013","sourceRef":"core-flow-10","capability":"Psychiatrist review, edits, rationale, and renewed checks","requirement":"required","implementationIssues":["INS-076","INS-077"],"contractSchemas":["planned:INS-076:treatment-plan-v1"],"releaseApplicability":{"research-build":"required","controlled-clinical":"required"}},
    {"id":"CAP-014","sourceRef":"core-flow-11","capability":"Attributable immutable Final Treatment Plan","requirement":"required","implementationIssues":["INS-076","INS-077"],"contractSchemas":["planned:INS-076:treatment-plan-v1"],"releaseApplicability":{"research-build":"required","controlled-clinical":"required"}},
    {"id":"CAP-015","sourceRef":"core-flow-12","capability":"Follow-up supersession without history mutation","requirement":"required","implementationIssues":["INS-076","INS-078"],"contractSchemas":["contracts/clinical-ownership-v1.json","planned:INS-076:treatment-plan-v1"],"releaseApplicability":{"research-build":"required","controlled-clinical":"required"}},

    {"id":"CAP-016","sourceRef":"feature-clinical-1","capability":"Role-based workspaces","requirement":"required","implementationIssues":["INS-067","INS-068"],"contractSchemas":["contracts/internal-service-auth-v1.json"],"releaseApplicability":{"research-build":"required","controlled-clinical":"required"}},
    {"id":"CAP-017","sourceRef":"feature-clinical-2","capability":"Canonical Patient UUID and patient-code alias","requirement":"required","implementationIssues":["INS-069"],"contractSchemas":["contracts/clinical-ownership-v1.json"],"releaseApplicability":{"research-build":"required","controlled-clinical":"required"}},
    {"id":"CAP-018","sourceRef":"feature-clinical-3","capability":"Encounter-based clinical records","requirement":"required","implementationIssues":["INS-069"],"contractSchemas":["contracts/clinical-ownership-v1.json"],"releaseApplicability":{"research-build":"required","controlled-clinical":"required"}},
    {"id":"CAP-019","sourceRef":"feature-clinical-4","capability":"Clinician-controlled schizophrenia diagnosis","requirement":"required","implementationIssues":["INS-070"],"contractSchemas":["contracts/scope-matrix-v1.json","planned:INS-070:diagnosis-v1"],"releaseApplicability":{"research-build":"required","controlled-clinical":"required"}},
    {"id":"CAP-020","sourceRef":"feature-clinical-5","capability":"Server-validated 30-item PANSS assessment","requirement":"required","implementationIssues":["INS-071"],"contractSchemas":["planned:INS-071:severity-v1"],"releaseApplicability":{"research-build":"required","controlled-clinical":"required"}},
    {"id":"CAP-021","sourceRef":"feature-clinical-6","capability":"Baseline, history, medication, response, adherence, contraindication, and risk capture","requirement":"required","implementationIssues":["INS-072"],"contractSchemas":["planned:INS-072:medical-history-v1"],"releaseApplicability":{"research-build":"required","controlled-clinical":"required"}},
    {"id":"CAP-022","sourceRef":"feature-clinical-7","capability":"Initial and follow-up longitudinal workflows","requirement":"required","implementationIssues":["INS-078"],"contractSchemas":["contracts/clinical-ownership-v1.json"],"releaseApplicability":{"research-build":"required","controlled-clinical":"required"}},

    {"id":"CAP-023","sourceRef":"feature-decision-1","capability":"Treatment Plan REST orchestrator","requirement":"required","implementationIssues":["INS-076"],"contractSchemas":["contracts/internal-service-auth-v1.json","planned:INS-076:treatment-plan-v1"],"releaseApplicability":{"research-build":"required","controlled-clinical":"required"}},
    {"id":"CAP-024","sourceRef":"feature-decision-2","capability":"Typed eligibility and data-quality policies","requirement":"required","implementationIssues":["INS-008","INS-010","INS-076"],"contractSchemas":["contracts/scope-matrix-v1.json","contracts/treatment-plan-safety-policy-v1.json"],"releaseApplicability":{"research-build":"required","controlled-clinical":"required"}},
    {"id":"CAP-025","sourceRef":"feature-decision-3","capability":"Typed deterministic safety findings","requirement":"required","implementationIssues":["INS-010","INS-076"],"contractSchemas":["contracts/treatment-plan-safety-policy-v1.json"],"releaseApplicability":{"research-build":"required","controlled-clinical":"required"}},
    {"id":"CAP-026","sourceRef":"feature-decision-4","capability":"Normalized medication DDI evaluation with source text preserved","requirement":"required","implementationIssues":["INS-072","INS-074"],"contractSchemas":["contracts/knowledge-source-manifest-v1.json","planned:INS-074:ddi-v1"],"releaseApplicability":{"research-build":"required","controlled-clinical":"required"}},
    {"id":"CAP-027","sourceRef":"feature-decision-5","capability":"Versioned Bayesian and influence-diagram pathways","requirement":"conditional","implementationIssues":["INS-007","INS-075"],"contractSchemas":["contracts/model-manifest-v1.json"],"releaseApplicability":{"research-build":"conditional","controlled-clinical":"conditional"}},
    {"id":"CAP-028","sourceRef":"feature-decision-5a","capability":"Treatment-setting pathway","requirement":"conditional","implementationIssues":["INS-075","INS-076"],"contractSchemas":["contracts/model-manifest-v1.json"],"releaseApplicability":{"research-build":"conditional","controlled-clinical":"conditional"}},